{"schemaVersion":"data.harness/v1","workerId":"wg-postgres","connectorId":"whitegoods.erp","runtimeMode":"process","imageDigest":null,"entrypointDigest":"sha256:aaaaaaaaaaaaaaaaaaaaaaaaaaaaaaaaaaaaaaaaaaaaaaaaaaaaaaaaaaaaaaaa","credentialReferences":["credential://whitegoods/postgres"],"limits":{"operationTimeoutMs":5000,"maxRequestBytes":262144,"maxResponseBytes":1048576,"maxParallelism":2},"networkMode":"host","certificationStatus":"process-isolation-only"}
